{
  "attributes": [
    {
      "name": "sk_customer_id",
      "nullable": false,
      "semantic_type": "customer_surrogate_key",
      "source_rule": "tpc-di-1.1.0-factholdings-unverified"
    },
    {
      "name": "position",
      "nullable": false,
      "semantic_type": "position_quantity",
      "source_rule": "tpc-di-1.1.0-factholdings-unverified"
    }
  ],
  "disposition": "partial",
  "grain": "one row per customer version",
  "holes": [],
  "identifiers": [
    "sk_customer_id"
  ],
  "model_id": "logical.position_by_customer",
  "schema_version": "logical-model/v1",
  "verification": [
    "gate.position_by_customer.nonnegative",
    "review.position_metrics.current_sketch"
  ]
}
