{
  "attributes": [
    {
      "name": "account_id",
      "nullable": false,
      "semantic_type": "account_natural_id",
      "source_rule": "tpc-di-1.1.0-dimaccount-scd2-unverified"
    },
    {
      "name": "effective_from",
      "nullable": false,
      "semantic_type": "version_effective_timestamp",
      "source_rule": "tpc-di-1.1.0-dimaccount-scd2-unverified"
    },
    {
      "name": "sk_account_id",
      "nullable": false,
      "semantic_type": "account_surrogate_key",
      "source_rule": "tpc-di-1.1.0-dimaccount-scd2-unverified"
    },
    {
      "name": "sk_customer_id",
      "nullable": false,
      "semantic_type": "customer_surrogate_key",
      "source_rule": "tpc-di-1.1.0-dimaccount-scd2-unverified"
    },
    {
      "name": "effective_to",
      "nullable": false,
      "semantic_type": "version_end_timestamp",
      "source_rule": "tpc-di-1.1.0-dimaccount-scd2-unverified"
    },
    {
      "name": "is_current",
      "nullable": false,
      "semantic_type": "current_version_flag",
      "source_rule": "tpc-di-1.1.0-dimaccount-scd2-unverified"
    },
    {
      "name": "status_id",
      "nullable": false,
      "semantic_type": "account_status_id",
      "source_rule": "tpc-di-1.1.0-dimaccount-scd2-unverified"
    },
    {
      "name": "tax_status_id",
      "nullable": true,
      "semantic_type": "tax_status_id",
      "source_rule": "tpc-di-1.1.0-dimaccount-scd2-unverified"
    }
  ],
  "disposition": "partial",
  "grain": "one row per account version (account_id, effective_from)",
  "holes": [
    {
      "fill_policy": "named_authority_or_approved_counterexample",
      "forbidden_evidence": [
        "raw_data",
        "target_schema",
        "projection"
      ],
      "id": "dim-account.broker-key",
      "owner_hat": "data-product-owner",
      "question": "How is SK_BrokerID resolved from CA_B_ID once DimBroker enters the slice?",
      "status": "open"
    },
    {
      "fill_policy": "named_authority_or_approved_counterexample",
      "forbidden_evidence": [
        "raw_data",
        "target_schema",
        "projection"
      ],
      "id": "dim-account.account-desc-attributes",
      "owner_hat": "domain-reviewer",
      "question": "Does CA_NAME version the dimension?",
      "status": "open"
    }
  ],
  "identifiers": [
    "account_id",
    "effective_from"
  ],
  "model_id": "logical.dim_account",
  "schema_version": "logical-model/v1",
  "verification": [
    "gate.dim_account.one_current_version_per_account",
    "gate.dim_account.versions_do_not_overlap",
    "review.dim_account.current_sketch"
  ]
}
